<?xml version="1.0" encoding="UTF-8"?>
<dataroot xmlns:od="urn:schemas-microsoft-com:officedata" xmlns:xsi="http://www.w3.org/2001/XMLSchema-instance"  xsi:noNamespaceSchemaLocation="Klienci.xsd" generated="2018-09-11T15:01:25">
<Klienci>
<IDklienta>1</IDklienta>
<ImieKlienta>Jan</ImieKlienta>
<NazwiskoKlienta>Kowalski</NazwiskoKlienta>
<IDwojewodztwa>12</IDwojewodztwa>
<KodPocztowyKlienta>43-190</KodPocztowyKlienta>
<MiastoKlienta>Mikołów</MiastoKlienta>
<UlicaKlienta>Rybnicka</UlicaKlienta>
<NrDomuKlienta>44</NrDomuKlienta>
</Klienci>
<Klienci>
<IDklienta>2</IDklienta>
<ImieKlienta>Piotr</ImieKlienta>
<NazwiskoKlienta>Nowak</NazwiskoKlienta>
<IDwojewodztwa>12</IDwojewodztwa>
<KodPocztowyKlienta>40-265</KodPocztowyKlienta>
<MiastoKlienta>Katowice</MiastoKlienta>
<UlicaKlienta>Mikołowska</UlicaKlienta>
<NrDomuKlienta>150</NrDomuKlienta>
</Klienci>
<Klienci>
<IDklienta>3</IDklienta>
<ImieKlienta>Marek</ImieKlienta>
<NazwiskoKlienta>Niedzielan</NazwiskoKlienta>
<IDwojewodztwa>12</IDwojewodztwa>
<KodPocztowyKlienta>43-190</KodPocztowyKlienta>
<MiastoKlienta>Mikołów</MiastoKlienta>
<UlicaKlienta>Krakowksa</UlicaKlienta>
<NrDomuKlienta>100</NrDomuKlienta>
</Klienci>
<Klienci>
<IDklienta>4</IDklienta>
<ImieKlienta>Katarzyna</ImieKlienta>
<NazwiskoKlienta>Więcek</NazwiskoKlienta>
<IDwojewodztwa>6</IDwojewodztwa>
<KodPocztowyKlienta>30-200</KodPocztowyKlienta>
<MiastoKlienta>Kraków</MiastoKlienta>
<UlicaKlienta>Smocza</UlicaKlienta>
<NrDomuKlienta>3/10</NrDomuKlienta>
</Klienci>
<Klienci>
<IDklienta>5</IDklienta>
<ImieKlienta>Maria</ImieKlienta>
<NazwiskoKlienta>Karolczak</NazwiskoKlienta>
<IDwojewodztwa>1</IDwojewodztwa>
<KodPocztowyKlienta>45-678</KodPocztowyKlienta>
<MiastoKlienta>Wrocław</MiastoKlienta>
<UlicaKlienta>Katowicka</UlicaKlienta>
<NrDomuKlienta>24</NrDomuKlienta>
</Klienci>
<Klienci>
<IDklienta>6</IDklienta>
<ImieKlienta>Adam</ImieKlienta>
<NazwiskoKlienta>Maliniak</NazwiskoKlienta>
<IDwojewodztwa>12</IDwojewodztwa>
<KodPocztowyKlienta>40-710</KodPocztowyKlienta>
<MiastoKlienta>Katowice</MiastoKlienta>
<UlicaKlienta>Słupska</UlicaKlienta>
<NrDomuKlienta>35</NrDomuKlienta>
</Klienci>
<Klienci>
<IDklienta>7</IDklienta>
<ImieKlienta>Andrzej</ImieKlienta>
<NazwiskoKlienta>Nowak</NazwiskoKlienta>
<IDwojewodztwa>12</IDwojewodztwa>
<KodPocztowyKlienta>43-190</KodPocztowyKlienta>
<MiastoKlienta>Tychy</MiastoKlienta>
<UlicaKlienta>Dębowa</UlicaKlienta>
<NrDomuKlienta>20</NrDomuKlienta>
</Klienci>
<Klienci>
<IDklienta>8</IDklienta>
<ImieKlienta>Antonina</ImieKlienta>
<NazwiskoKlienta>Kowalczyk</NazwiskoKlienta>
<IDwojewodztwa>12</IDwojewodztwa>
<KodPocztowyKlienta>44-500</KodPocztowyKlienta>
<MiastoKlienta>Katowice</MiastoKlienta>
<UlicaKlienta>Kopernika</UlicaKlienta>
<NrDomuKlienta>50/21</NrDomuKlienta>
</Klienci>
<Klienci>
<IDklienta>9</IDklienta>
<ImieKlienta>Leszek</ImieKlienta>
<NazwiskoKlienta>Pusz</NazwiskoKlienta>
<IDwojewodztwa>7</IDwojewodztwa>
<KodPocztowyKlienta>02-770</KodPocztowyKlienta>
<MiastoKlienta>Warszawa</MiastoKlienta>
<UlicaKlienta>Wiejska</UlicaKlienta>
<NrDomuKlienta>50</NrDomuKlienta>
</Klienci>
<Klienci>
<IDklienta>10</IDklienta>
<ImieKlienta>Kunegunda</ImieKlienta>
<NazwiskoKlienta>Piszczak</NazwiskoKlienta>
<IDwojewodztwa>12</IDwojewodztwa>
<KodPocztowyKlienta>44-521</KodPocztowyKlienta>
<MiastoKlienta>Katowice</MiastoKlienta>
<UlicaKlienta>Andrzeja</UlicaKlienta>
<NrDomuKlienta>56</NrDomuKlienta>
</Klienci>
<Klienci>
<IDklienta>11</IDklienta>
<ImieKlienta>Jan</ImieKlienta>
<NazwiskoKlienta>Jankowski</NazwiskoKlienta>
<IDwojewodztwa>12</IDwojewodztwa>
<KodPocztowyKlienta>43-190</KodPocztowyKlienta>
<MiastoKlienta>Mikołów</MiastoKlienta>
<UlicaKlienta>Jasna</UlicaKlienta>
<NrDomuKlienta>12</NrDomuKlienta>
</Klienci>
</dataroot>
